{
  "schema_version": "1.0.0",
  "profile_type": "SOURCE_TABLE_STRUCTURE",
  "status": "VALID",
  "source_snapshot_id": "1111111111111111111111111111111111111111111111111111111111111111",
  "source_contract_sha256": "2222222222222222222222222222222222222222222222222222222222222222",
  "source_table_contract_sha256": "3333333333333333333333333333333333333333333333333333333333333333",
  "table_count": 2,
  "tables": [
    {
      "id": "synthetic_measurements",
      "source_id": "synthetic_csv_source",
      "filename": "synthetic_measurements.csv",
      "container": "CSV",
      "sheet_name": null,
      "encoding": "UTF-8",
      "byte_order_mark": "ABSENT",
      "csv_dialect": {
        "delimiter": ",",
        "quote_character": "\"",
        "line_ending": "LF"
      },
      "header_row": 1,
      "data_row_count": 3,
      "header_cell_count": 2,
      "named_column_count": 2,
      "data_row_field_count": 2,
      "unnamed_header_positions": [],
      "header_sha256": "36c0e1a23a92660953ff70673fa32b6b015966f8d5ffb780a2fae1cfe60feeed",
      "required_column_types": {
        "unit_id": "STRING",
        "amount": "NUMBER"
      },
      "record_key_evidence": {
        "columns": [
          "unit_id"
        ],
        "nonblank_rows": 3,
        "distinct_count": 3,
        "duplicate_rows_beyond_first": 0
      },
      "exact_duplicate_rows_beyond_first": 0
    },
    {
      "id": "synthetic_regions",
      "source_id": "synthetic_workbook_source",
      "filename": "synthetic_regions.xlsx",
      "container": "XLSX",
      "sheet_name": "Regions",
      "encoding": "NOT_APPLICABLE_BINARY",
      "byte_order_mark": "NOT_APPLICABLE",
      "csv_dialect": null,
      "header_row": 1,
      "data_row_count": 2,
      "header_cell_count": 2,
      "named_column_count": 2,
      "data_row_field_count": 2,
      "unnamed_header_positions": [],
      "header_sha256": "10a52cd419cfbf08f73efc53cbc46601d7af51cff8eca367b2e6089a8ce6d85d",
      "required_column_types": {
        "region_id": "STRING",
        "label": "STRING"
      },
      "record_key_evidence": {
        "columns": [
          "region_id"
        ],
        "nonblank_rows": 2,
        "distinct_count": 1,
        "duplicate_rows_beyond_first": 1
      },
      "exact_duplicate_rows_beyond_first": 0
    }
  ]
}
